{
  "extension": {
    "categories": [
      "tutorial",
      "playback"
    ],
    "description": "这只是一个 H.265 解码器安装教程，有更好的方案也欢迎提交。\n\n列出 Microsoft Store 中的免费资格版和付费版 HEVC 扩展。两者均为闭源组件；免费版受设备和地区资格限制，付费扩展由 Microsoft Corporation 发布，价格以商店为准。浏览器通常还需要硬件解码",
    "homepage": "https://github.com/PackingProof/PackingProof-HEVC-Tutorial",
    "id": "packingproof.hevc-playback-tutorial",
    "license": {
      "sourceUrl": "https://github.com/PackingProof/PackingProof-HEVC-Tutorial/blob/main/LICENSE",
      "spdx": "AGPL-3.0-only"
    },
    "name": "H.265 解码器安装教程",
    "publisherId": "packingproof",
    "releaseSources": [
      {
        "name": "PackingProof-HEVC-Tutorial",
        "owner": "PackingProof",
        "provider": "gitee"
      },
      {
        "name": "PackingProof-HEVC-Tutorial",
        "owner": "PackingProof",
        "provider": "github"
      }
    ],
    "repository": {
      "name": "PackingProof-HEVC-Tutorial",
      "owner": "PackingProof",
      "provider": "github"
    },
    "schemaVersion": 1,
    "sourceAvailability": "open-source",
    "summary": "介绍 Windows 与 Edge 中 H.265（HEVC）解码器的微软官方商店入口",
    "type": "external-adapter"
  },
  "publisher": {
    "accounts": {
      "gitee": "PackingProof",
      "github": "PackingProof"
    },
    "displayName": "PackingProof",
    "homepage": "https://github.com/PackingProof",
    "id": "packingproof",
    "schemaVersion": 1
  },
  "riskLabels": [
    "external-program"
  ],
  "schemaVersion": 1,
  "trust": "official",
  "versions": [
    {
      "advisory": null,
      "release": {
        "access": {
          "packingProofCapabilities": [],
          "packingProofPermissions": [],
          "systemAccess": []
        },
        "compatibility": {
          "minPackingProofVersion": "0.0.64",
          "platforms": {
            "windows": [
              "any"
            ]
          }
        },
        "downloads": {
          "gitee": {
            "provider": "gitee",
            "url": "https://gitee.com/PackingProof/PackingProof-HEVC-Tutorial/releases/download/v1.0.1/packingproof.hevc-playback-tutorial-1.0.1.ppext"
          },
          "github": {
            "provider": "github",
            "url": "https://github.com/PackingProof/PackingProof-HEVC-Tutorial/releases/download/v1.0.1/packingproof.hevc-playback-tutorial-1.0.1.ppext"
          }
        },
        "extensionId": "packingproof.hevc-playback-tutorial",
        "publishedAt": "2026-10-25T15:35:44+08:00",
        "schemaVersion": 1,
        "sha256": "96207fc2eaf70e9cee819af533604d358a855e096f399ee4f29ec56f024ffc62",
        "size": 6365,
        "source": {
          "commit": "6af22583456b1374c116b7dd62d847c8a9e15554",
          "tag": "v1.0.1"
        },
        "version": "1.0.1"
      },
      "status": "available"
    }
  ]
}
