{
  "extension": {
    "description": "仓库人员扫描快递单号后，适配器自动查询快麦订单，并把商家编码、商品件数、买卖家备注和退款状态通过 PackingProof 扩展 API v1 安全回传。独立运行的 Node.js 外部适配器，只通过扩展 API 通信，不读取数据库、配置文件或录像目录。",
    "homepage": "https://github.com/369431/PackingProof-KuaimaiERP",
    "id": "369431.kuaimai-erp",
    "license": {
      "sourceUrl": "https://github.com/369431/PackingProof-KuaimaiERP/blob/main/LICENSE",
      "spdx": "AGPL-3.0-only"
    },
    "name": "PackingProof 快麦 ERP 适配器",
    "publisherId": "369431",
    "releaseSources": [
      {
        "name": "PackingProof-KuaimaiERP",
        "owner": "369431",
        "provider": "github"
      }
    ],
    "repository": {
      "name": "PackingProof-KuaimaiERP",
      "owner": "369431",
      "provider": "github"
    },
    "schemaVersion": 1,
    "sourceAvailability": "open-source",
    "summary": "把 PackingProof 扫码任务接入快麦 ERP，自动查询并回传订单、件数和退款状态",
    "type": "external-adapter"
  },
  "publisher": {
    "accounts": {
      "github": "369431"
    },
    "displayName": "369431",
    "homepage": "https://github.com/369431",
    "id": "369431",
    "schemaVersion": 1
  },
  "riskLabels": [
    "external-program"
  ],
  "schemaVersion": 1,
  "trust": "third-party",
  "versions": [
    {
      "advisory": null,
      "release": {
        "access": {
          "packingProofCapabilities": [],
          "packingProofPermissions": [],
          "systemAccess": []
        },
        "compatibility": {
          "minPackingProofVersion": "0.0.63",
          "platforms": {
            "windows": [
              "any"
            ]
          }
        },
        "downloads": {
          "github": {
            "provider": "github",
            "url": "https://github.com/369431/PackingProof-KuaimaiERP/releases/download/v1.0.3/369431.kuaimai-erp-1.0.3.ppext"
          }
        },
        "extensionId": "369431.kuaimai-erp",
        "publishedAt": "2026-09-06T13:09:09Z",
        "schemaVersion": 1,
        "sha256": "74d7f07555a1719777bbd87d62c45d0bf24296395469d4402e8a2ecb92c9fc15",
        "size": 23866,
        "source": {
          "commit": "98b05ee6004cb4f2fd017984a428591f66e87d71",
          "tag": "v1.0.3"
        },
        "version": "1.0.3"
      },
      "status": "available"
    },
    {
      "advisory": null,
      "release": {
        "access": {
          "packingProofCapabilities": [],
          "packingProofPermissions": [],
          "systemAccess": []
        },
        "compatibility": {
          "minPackingProofVersion": "0.0.63",
          "platforms": {
            "windows": [
              "any"
            ]
          }
        },
        "downloads": {
          "github": {
            "provider": "github",
            "url": "https://github.com/369431/PackingProof-KuaimaiERP/releases/download/v1.0.2/369431.kuaimai-erp-1.0.2.ppext"
          }
        },
        "extensionId": "369431.kuaimai-erp",
        "publishedAt": "2026-09-06T11:51:35Z",
        "schemaVersion": 1,
        "sha256": "d349fda3ef67d6bb6569d47e582154aa81f458be22c2c9b38e9bb865278382a0",
        "size": 23701,
        "source": {
          "commit": "c47184bdf7857c8885e26065537d9f06feb66045",
          "tag": "v1.0.2"
        },
        "version": "1.0.2"
      },
      "status": "available"
    },
    {
      "advisory": null,
      "release": {
        "access": {
          "packingProofCapabilities": [],
          "packingProofPermissions": [],
          "systemAccess": []
        },
        "compatibility": {
          "minPackingProofVersion": "0.0.63",
          "platforms": {
            "windows": [
              "any"
            ]
          }
        },
        "downloads": {
          "github": {
            "provider": "github",
            "url": "https://github.com/369431/PackingProof-KuaimaiERP/releases/download/v1.0.1/369431.kuaimai-erp-1.0.1.ppext"
          }
        },
        "extensionId": "369431.kuaimai-erp",
        "publishedAt": "2026-08-30T17:43:39Z",
        "schemaVersion": 1,
        "sha256": "58abff771326d9c9e799ee7ed63a2c7e3a472a1c7eff51a5198f5577f6b0af60",
        "size": 23348,
        "source": {
          "commit": "c2722bed7c351f67da30fbd1156e9eda1d0fadbd",
          "tag": "v1.0.1"
        },
        "version": "1.0.1"
      },
      "status": "available"
    },
    {
      "advisory": null,
      "release": {
        "access": {
          "packingProofCapabilities": [],
          "packingProofPermissions": [],
          "systemAccess": []
        },
        "compatibility": {
          "minPackingProofVersion": "0.0.63",
          "platforms": {
            "windows": [
              "any"
            ]
          }
        },
        "downloads": {
          "github": {
            "provider": "github",
            "url": "https://github.com/369431/PackingProof-KuaimaiERP/releases/download/v1.0.0/369431.kuaimai-erp-1.0.0.ppext"
          }
        },
        "extensionId": "369431.kuaimai-erp",
        "publishedAt": "2026-08-30T16:34:07Z",
        "schemaVersion": 1,
        "sha256": "69523e7aa42e0da393013a5d6003917d98b99c748ee16814395a66d63d462ac0",
        "size": 24215,
        "source": {
          "commit": "4e8b1f7df917fa3d393ce91088fb4b6d2463e249",
          "tag": "v1.0.0"
        },
        "version": "1.0.0"
      },
      "status": "available"
    }
  ]
}
