{
  "extension": {
    "categories": [
      "orders",
      "userscript"
    ],
    "description": "安装到浏览器脚本管理器后，在快递助手批量打印页面运行。\n\n读取订单、买家留言、卖家备注、商品明细和打印后的退款状态，并发送到用户选择的录像设备或保存主机",
    "homepage": "https://github.com/PackingProof/PackingProof-KDZS",
    "id": "packingproof.kdzs",
    "license": {
      "sourceUrl": "https://github.com/PackingProof/PackingProof-KDZS/blob/main/LICENSE",
      "spdx": "AGPL-3.0-only"
    },
    "name": "快递助手订单联动",
    "publisherId": "packingproof",
    "releaseSources": [
      {
        "name": "PackingProof-KDZS",
        "owner": "PackingProof",
        "provider": "gitee"
      },
      {
        "name": "PackingProof-KDZS",
        "owner": "PackingProof",
        "provider": "github"
      }
    ],
    "repository": {
      "name": "PackingProof-KDZS",
      "owner": "PackingProof",
      "provider": "github"
    },
    "schemaVersion": 1,
    "sourceAvailability": "open-source",
    "summary": "从快递助手页面读取订单、备注和退款状态，并发送到已配置的录像设备或保存主机",
    "type": "userscript"
  },
  "publisher": {
    "accounts": {
      "gitee": "PackingProof",
      "github": "PackingProof"
    },
    "displayName": "PackingProof",
    "homepage": "https://github.com/PackingProof",
    "id": "packingproof",
    "schemaVersion": 1
  },
  "riskLabels": [],
  "schemaVersion": 1,
  "trust": "official",
  "versions": [
    {
      "advisory": null,
      "release": {
        "access": {
          "packingProofCapabilities": [],
          "packingProofPermissions": [],
          "systemAccess": []
        },
        "compatibility": {
          "minPackingProofVersion": "0.0.63",
          "platforms": {
            "userscript": [
              "any"
            ]
          }
        },
        "downloads": {
          "gitee": {
            "provider": "gitee",
            "url": "https://gitee.com/PackingProof/PackingProof-KDZS/releases/download/v2.18/packingproof.kdzs-2.18.ppext"
          },
          "github": {
            "provider": "github",
            "url": "https://github.com/PackingProof/PackingProof-KDZS/releases/download/v2.18/packingproof.kdzs-2.18.ppext"
          }
        },
        "extensionId": "packingproof.kdzs",
        "publishedAt": "2026-10-18T06:10:26Z",
        "schemaVersion": 1,
        "sha256": "3e06e9a066603631c873ec56f0c199714a69c02df2bcf81df97de9390625a71f",
        "size": 32761,
        "source": {
          "commit": "d419b7179bd28e23130bd04855c7473d67a7bff3",
          "tag": "v2.18"
        },
        "version": "2.18"
      },
      "status": "available"
    },
    {
      "advisory": null,
      "release": {
        "access": {
          "packingProofCapabilities": [],
          "packingProofPermissions": [],
          "systemAccess": []
        },
        "compatibility": {
          "minPackingProofVersion": "0.0.63",
          "platforms": {
            "userscript": [
              "any"
            ]
          }
        },
        "downloads": {
          "gitee": {
            "provider": "gitee",
            "url": "https://gitee.com/PackingProof/PackingProof-KDZS/releases/download/v2.17/packingproof.kdzs-2.17.ppext"
          },
          "github": {
            "provider": "github",
            "url": "https://github.com/PackingProof/PackingProof-KDZS/releases/download/v2.17/packingproof.kdzs-2.17.ppext"
          }
        },
        "extensionId": "packingproof.kdzs",
        "publishedAt": "2026-10-06T07:21:08Z",
        "schemaVersion": 1,
        "sha256": "882cea83021a4e987de3218c10c3bacc7a5d4662baf4c548e85f23e0c3cc5af5",
        "size": 31615,
        "source": {
          "commit": "3a2fe87db6e9320a3bc20a6fe2a8739e6d142e0b",
          "tag": "v2.17"
        },
        "version": "2.17"
      },
      "status": "available"
    },
    {
      "advisory": null,
      "release": {
        "access": {
          "packingProofCapabilities": [],
          "packingProofPermissions": [],
          "systemAccess": []
        },
        "compatibility": {
          "minPackingProofVersion": "0.0.63",
          "platforms": {
            "userscript": [
              "any"
            ]
          }
        },
        "downloads": {
          "gitee": {
            "provider": "gitee",
            "url": "https://gitee.com/PackingProof/PackingProof-KDZS/releases/download/v2.16/packingproof.kdzs-2.16.ppext"
          },
          "github": {
            "provider": "github",
            "url": "https://github.com/PackingProof/PackingProof-KDZS/releases/download/v2.16/packingproof.kdzs-2.16.ppext"
          }
        },
        "extensionId": "packingproof.kdzs",
        "publishedAt": "2026-10-04T12:21:28Z",
        "schemaVersion": 1,
        "sha256": "3e43fa623a88e2532c89725c077d5da73d82d581bcce9065d3533ead6642eb95",
        "size": 30563,
        "source": {
          "commit": "f988c3c2cfa48dd9bc2119bba7949f0edfed06dc",
          "tag": "v2.16"
        },
        "version": "2.16"
      },
      "status": "available"
    },
    {
      "advisory": null,
      "release": {
        "access": {
          "packingProofCapabilities": [],
          "packingProofPermissions": [],
          "systemAccess": []
        },
        "compatibility": {
          "minPackingProofVersion": "0.0.63",
          "platforms": {
            "userscript": [
              "any"
            ]
          }
        },
        "downloads": {
          "gitee": {
            "provider": "gitee",
            "url": "https://gitee.com/PackingProof/PackingProof-KDZS/releases/download/v2.15/packingproof.kdzs-2.15.ppext"
          },
          "github": {
            "provider": "github",
            "url": "https://github.com/PackingProof/PackingProof-KDZS/releases/download/v2.15/packingproof.kdzs-2.15.ppext"
          }
        },
        "extensionId": "packingproof.kdzs",
        "publishedAt": "2026-08-29T16:11:17Z",
        "schemaVersion": 1,
        "sha256": "b4e50e127ae4d1c8d1740fd99f318692310be2caadd5b86a89442ad2eab7468f",
        "size": 28605,
        "source": {
          "commit": "2dd1dd52aad0c39e18d1ccb1002f375201f2ed7f",
          "tag": "v2.15"
        },
        "version": "2.15"
      },
      "status": "available"
    },
    {
      "advisory": {
        "$schema": "../../schemas/advisory.v1.schema.json",
        "extensionId": "packingproof.kdzs",
        "message": "该版本在市场预发布阶段错误地将 userscript 两段源版本补为三段，扩展已迁移至独立仓库并按规范重新发布",
        "reasonCode": "other",
        "replacedBy": "2.14",
        "schemaVersion": 1,
        "status": "withdrawn",
        "version": "2.14.0",
        "withdrawnAt": "2026-08-29T23:04:17+08:00"
      },
      "release": {
        "access": {
          "packingProofCapabilities": [],
          "packingProofPermissions": [],
          "systemAccess": []
        },
        "compatibility": {
          "minPackingProofVersion": "0.0.63",
          "platforms": {
            "userscript": [
              "any"
            ]
          }
        },
        "downloads": {
          "gitee": {
            "provider": "gitee",
            "url": "https://gitee.com/PackingProof/PackingProof-Desktop/releases/download/v0.0.62/packingproof.kdzs-2.14.0.ppext"
          },
          "github": {
            "provider": "github",
            "url": "https://github.com/PackingProof/PackingProof-Desktop/releases/download/v0.0.62/packingproof.kdzs-2.14.0.ppext"
          }
        },
        "extensionId": "packingproof.kdzs",
        "publishedAt": "2026-08-29T03:44:57Z",
        "schemaVersion": 1,
        "sha256": "77820c50cfe775fc30281a2f36e0f561b3e77059e36030dc5dfd87b4516baedc",
        "size": 15795,
        "source": {
          "commit": "c68de6092564d1e1b8551ac61ce7c97e5b3c5884",
          "tag": "v0.0.62"
        },
        "version": "2.14.0"
      },
      "status": "withdrawn"
    },
    {
      "advisory": null,
      "release": {
        "access": {
          "packingProofCapabilities": [],
          "packingProofPermissions": [],
          "systemAccess": []
        },
        "compatibility": {
          "minPackingProofVersion": "0.0.63",
          "platforms": {
            "userscript": [
              "any"
            ]
          }
        },
        "downloads": {
          "gitee": {
            "provider": "gitee",
            "url": "https://gitee.com/PackingProof/PackingProof-KDZS/releases/download/v2.14/packingproof.kdzs-2.14.ppext"
          },
          "github": {
            "provider": "github",
            "url": "https://github.com/PackingProof/PackingProof-KDZS/releases/download/v2.14/packingproof.kdzs-2.14.ppext"
          }
        },
        "extensionId": "packingproof.kdzs",
        "publishedAt": "2026-08-29T15:03:25Z",
        "schemaVersion": 1,
        "sha256": "c308eef5dfcd764680452f6f3c7403a88600d92a3565da43819c7c1c74a5d75e",
        "size": 28619,
        "source": {
          "commit": "8197ef300e11200d01008202a7774804e2a9e9b2",
          "tag": "v2.14"
        },
        "version": "2.14"
      },
      "status": "available"
    }
  ]
}
